{
  "$schema": "https://json-schema.org/draft/2020-12/schema",
  "type": "object",
  "properties": {
    "schema_version": {
      "const": 1
    },
    "id": {
      "type": "string",
      "maxLength": 256
    },
    "boot_id": {
      "type": "string",
      "maxLength": 256
    },
    "sequence": {
      "type": "integer",
      "minimum": 0
    },
    "observed_at": {
      "type": [
        "string",
        "null"
      ],
      "format": "date-time"
    },
    "received_at": {
      "type": [
        "string",
        "null"
      ],
      "format": "date-time"
    },
    "interval_ms": {
      "type": [
        "integer",
        "null"
      ],
      "minimum": 0,
      "maximum": 9007199254740991
    },
    "scope": {
      "const": "host"
    },
    "cpu": {
      "type": "object",
      "properties": {
        "status": {
          "enum": [
            "ok",
            "warming_up",
            "unsupported",
            "permission_denied",
            "error",
            "stale"
          ]
        },
        "reason": {
          "type": [
            "string",
            "null"
          ],
          "maxLength": 128
        },
        "observed_at": {
          "type": [
            "string",
            "null"
          ],
          "format": "date-time"
        },
        "collection_duration_ms": {
          "type": [
            "number",
            "null"
          ],
          "minimum": 0,
          "maximum": 1e+18
        },
        "utilization_percent": {
          "type": [
            "number",
            "null"
          ],
          "minimum": 0,
          "maximum": 100
        }
      },
      "required": [
        "status"
      ],
      "additionalProperties": false
    },
    "memory": {
      "type": "object",
      "properties": {
        "status": {
          "enum": [
            "ok",
            "warming_up",
            "unsupported",
            "permission_denied",
            "error",
            "stale"
          ]
        },
        "reason": {
          "type": [
            "string",
            "null"
          ],
          "maxLength": 128
        },
        "observed_at": {
          "type": [
            "string",
            "null"
          ],
          "format": "date-time"
        },
        "collection_duration_ms": {
          "type": [
            "number",
            "null"
          ],
          "minimum": 0,
          "maximum": 1e+18
        },
        "total_bytes": {
          "type": [
            "integer",
            "null"
          ],
          "minimum": 0,
          "maximum": 9007199254740991
        },
        "available_bytes": {
          "type": [
            "integer",
            "null"
          ],
          "minimum": 0,
          "maximum": 9007199254740991
        },
        "used_bytes": {
          "type": [
            "integer",
            "null"
          ],
          "minimum": 0,
          "maximum": 9007199254740991
        },
        "swap_total_bytes": {
          "type": [
            "integer",
            "null"
          ],
          "minimum": 0,
          "maximum": 9007199254740991
        },
        "swap_used_bytes": {
          "type": [
            "integer",
            "null"
          ],
          "minimum": 0,
          "maximum": 9007199254740991
        }
      },
      "required": [
        "status"
      ],
      "additionalProperties": false
    },
    "disks": {
      "type": "object",
      "properties": {
        "status": {
          "enum": [
            "ok",
            "warming_up",
            "unsupported",
            "permission_denied",
            "error",
            "stale"
          ]
        },
        "reason": {
          "type": [
            "string",
            "null"
          ],
          "maxLength": 128
        },
        "observed_at": {
          "type": [
            "string",
            "null"
          ],
          "format": "date-time"
        },
        "collection_duration_ms": {
          "type": [
            "number",
            "null"
          ],
          "minimum": 0,
          "maximum": 1e+18
        },
        "devices": {
          "type": "array",
          "maxItems": 32,
          "items": {
            "type": "object",
            "properties": {
              "id": {
                "type": "string",
                "maxLength": 256
              },
              "total_bytes": {
                "type": [
                  "integer",
                  "null"
                ],
                "minimum": 0,
                "maximum": 9007199254740991
              },
              "available_bytes": {
                "type": [
                  "integer",
                  "null"
                ],
                "minimum": 0,
                "maximum": 9007199254740991
              }
            },
            "required": [
              "id"
            ],
            "additionalProperties": false
          }
        },
        "truncated": {
          "type": "boolean"
        }
      },
      "required": [
        "status"
      ],
      "additionalProperties": false
    },
    "disk_io": {
      "type": "object",
      "properties": {
        "status": {
          "enum": [
            "ok",
            "warming_up",
            "unsupported",
            "permission_denied",
            "error",
            "stale"
          ]
        },
        "reason": {
          "type": [
            "string",
            "null"
          ],
          "maxLength": 128
        },
        "observed_at": {
          "type": [
            "string",
            "null"
          ],
          "format": "date-time"
        },
        "collection_duration_ms": {
          "type": [
            "number",
            "null"
          ],
          "minimum": 0,
          "maximum": 1e+18
        },
        "devices": {
          "type": "array",
          "maxItems": 32,
          "items": {
            "type": "object",
            "properties": {
              "id": {
                "type": "string",
                "maxLength": 256
              },
              "read_bytes": {
                "type": [
                  "integer",
                  "null"
                ],
                "minimum": 0,
                "maximum": 9007199254740991
              },
              "write_bytes": {
                "type": [
                  "integer",
                  "null"
                ],
                "minimum": 0,
                "maximum": 9007199254740991
              },
              "read_bytes_per_second": {
                "type": [
                  "number",
                  "null"
                ],
                "minimum": 0,
                "maximum": 1e+18
              },
              "write_bytes_per_second": {
                "type": [
                  "number",
                  "null"
                ],
                "minimum": 0,
                "maximum": 1e+18
              }
            },
            "required": [
              "id"
            ],
            "additionalProperties": false
          }
        }
      },
      "required": [
        "status"
      ],
      "additionalProperties": false
    },
    "network": {
      "type": "object",
      "properties": {
        "status": {
          "enum": [
            "ok",
            "warming_up",
            "unsupported",
            "permission_denied",
            "error",
            "stale"
          ]
        },
        "reason": {
          "type": [
            "string",
            "null"
          ],
          "maxLength": 128
        },
        "observed_at": {
          "type": [
            "string",
            "null"
          ],
          "format": "date-time"
        },
        "collection_duration_ms": {
          "type": [
            "number",
            "null"
          ],
          "minimum": 0,
          "maximum": 1e+18
        },
        "devices": {
          "type": "array",
          "maxItems": 64,
          "items": {
            "type": "object",
            "properties": {
              "id": {
                "type": "string",
                "maxLength": 256
              },
              "rx_bytes": {
                "type": [
                  "integer",
                  "null"
                ],
                "minimum": 0,
                "maximum": 9007199254740991
              },
              "tx_bytes": {
                "type": [
                  "integer",
                  "null"
                ],
                "minimum": 0,
                "maximum": 9007199254740991
              },
              "rx_bytes_per_second": {
                "type": [
                  "number",
                  "null"
                ],
                "minimum": 0,
                "maximum": 1e+18
              },
              "tx_bytes_per_second": {
                "type": [
                  "number",
                  "null"
                ],
                "minimum": 0,
                "maximum": 1e+18
              }
            },
            "required": [
              "id"
            ],
            "additionalProperties": false
          }
        },
        "truncated": {
          "type": "boolean"
        }
      },
      "required": [
        "status"
      ],
      "additionalProperties": false
    },
    "gpu": {
      "type": "object",
      "properties": {
        "status": {
          "enum": [
            "ok",
            "warming_up",
            "unsupported",
            "permission_denied",
            "error",
            "stale"
          ]
        },
        "reason": {
          "type": [
            "string",
            "null"
          ],
          "maxLength": 128
        },
        "observed_at": {
          "type": [
            "string",
            "null"
          ],
          "format": "date-time"
        },
        "collection_duration_ms": {
          "type": [
            "number",
            "null"
          ],
          "minimum": 0,
          "maximum": 1e+18
        },
        "devices": {
          "type": "array",
          "maxItems": 16,
          "items": {
            "type": "object",
            "properties": {
              "id": {
                "type": "string",
                "maxLength": 256
              },
              "utilization_percent": {
                "type": [
                  "number",
                  "null"
                ],
                "minimum": 0,
                "maximum": 100
              },
              "memory_total_bytes": {
                "type": [
                  "integer",
                  "null"
                ],
                "minimum": 0,
                "maximum": 9007199254740991
              },
              "memory_used_bytes": {
                "type": [
                  "integer",
                  "null"
                ],
                "minimum": 0,
                "maximum": 9007199254740991
              },
              "memory_kind": {
                "enum": [
                  "dedicated",
                  "shared",
                  "unknown"
                ]
              },
              "temperature_celsius": {
                "type": [
                  "number",
                  "null"
                ],
                "minimum": 0,
                "maximum": 1e+18
              },
              "power_watts": {
                "type": [
                  "number",
                  "null"
                ],
                "minimum": 0,
                "maximum": 1e+18
              },
              "power_domain": {
                "type": "string",
                "maxLength": 256
              }
            },
            "required": [
              "id"
            ],
            "additionalProperties": false
          }
        }
      },
      "required": [
        "status"
      ],
      "additionalProperties": false
    },
    "thermal": {
      "type": "object",
      "properties": {
        "status": {
          "enum": [
            "ok",
            "warming_up",
            "unsupported",
            "permission_denied",
            "error",
            "stale"
          ]
        },
        "reason": {
          "type": [
            "string",
            "null"
          ],
          "maxLength": 128
        },
        "observed_at": {
          "type": [
            "string",
            "null"
          ],
          "format": "date-time"
        },
        "collection_duration_ms": {
          "type": [
            "number",
            "null"
          ],
          "minimum": 0,
          "maximum": 1e+18
        },
        "devices": {
          "type": "array",
          "maxItems": 64,
          "items": {
            "type": "object",
            "properties": {
              "id": {
                "type": "string",
                "maxLength": 256
              },
              "temperature_celsius": {
                "type": [
                  "number",
                  "null"
                ],
                "minimum": 0,
                "maximum": 1e+18
              }
            },
            "required": [
              "id"
            ],
            "additionalProperties": false
          }
        }
      },
      "required": [
        "status"
      ],
      "additionalProperties": false
    },
    "power": {
      "type": "object",
      "properties": {
        "status": {
          "enum": [
            "ok",
            "warming_up",
            "unsupported",
            "permission_denied",
            "error",
            "stale"
          ]
        },
        "reason": {
          "type": [
            "string",
            "null"
          ],
          "maxLength": 128
        },
        "observed_at": {
          "type": [
            "string",
            "null"
          ],
          "format": "date-time"
        },
        "collection_duration_ms": {
          "type": [
            "number",
            "null"
          ],
          "minimum": 0,
          "maximum": 1e+18
        },
        "devices": {
          "type": "array",
          "maxItems": 32,
          "items": {
            "type": "object",
            "properties": {
              "id": {
                "type": "string",
                "maxLength": 256
              },
              "watts": {
                "type": [
                  "number",
                  "null"
                ],
                "minimum": 0,
                "maximum": 1e+18
              },
              "domain": {
                "type": "string",
                "maxLength": 256
              }
            },
            "required": [
              "id"
            ],
            "additionalProperties": false
          }
        }
      },
      "required": [
        "status"
      ],
      "additionalProperties": false
    }
  },
  "required": [
    "schema_version",
    "id",
    "boot_id",
    "sequence",
    "observed_at",
    "scope"
  ],
  "additionalProperties": false
}
